{
  "protocolVersion": 1,
  "headerBytes": 8,
  "frameKinds": { "started": 1, "output": 2, "exited": 3, "error": 4 },
  "limits": {
    "maxInputBytes": 65536,
    "maxOutputFrameBytes": 32768,
    "maxChannelFrameBytes": 40960,
    "maxSurfaceKeyBytes": 256,
    "maxAttachmentIdBytes": 64,
    "maxErrorSummaryBytes": 256,
    "maxInputSequence": 9007199254740991,
    "minCols": 1,
    "maxCols": 500,
    "minRows": 1,
    "maxRows": 500,
    "maxPixel": 10000,
    "maxTargetGeneration": 9007199254740991
  },
  "requests": {
    "attach": {
      "schemaVersion": 1,
      "surfaceKey": "global-terminal",
      "targetGeneration": 0,
      "cols": 80,
      "rows": 24,
      "pixelWidth": 0,
      "pixelHeight": 0
    },
    "input": {
      "schemaVersion": 1,
      "surfaceKey": "global-terminal",
      "attachmentId": "0123456789abcdef0123456789abcdef",
      "targetGeneration": 1,
      "inputSequence": 1,
      "bytes": [65]
    },
    "resize": {
      "schemaVersion": 1,
      "surfaceKey": "global-terminal",
      "attachmentId": "0123456789abcdef0123456789abcdef",
      "targetGeneration": 1,
      "cols": 100,
      "rows": 40,
      "pixelWidth": 0,
      "pixelHeight": 0
    },
    "acknowledge": {
      "schemaVersion": 1,
      "surfaceKey": "global-terminal",
      "attachmentId": "0123456789abcdef0123456789abcdef",
      "targetGeneration": 1,
      "sequence": 1
    },
    "detach": {
      "schemaVersion": 1,
      "surfaceKey": "global-terminal",
      "attachmentId": "0123456789abcdef0123456789abcdef",
      "targetGeneration": 1
    }
  },
  "receipt": {
    "schemaVersion": 1,
    "attachmentId": "0123456789abcdef0123456789abcdef",
    "surfaceKey": "global-terminal",
    "targetGeneration": 1
  },
  "errors": {
    "maxSummaryBytes": 256,
    "codes": [
      "invalid_request",
      "invalid_surface",
      "surface_unavailable",
      "stale_target",
      "wrong_attachment",
      "attachment_limit",
      "session_unavailable",
      "pty_unavailable",
      "input_too_large",
      "invalid_resize",
      "channel_closed",
      "backpressure",
      "runtime_unavailable",
      "internal"
    ]
  },
  "exitReasons": ["eof", "detached", "childExited"],
  "started": {
    "type": "started",
    "schemaVersion": 1,
    "attachmentId": "0123456789abcdef0123456789abcdef",
    "sequence": 0,
    "surfaceKey": "global-terminal",
    "targetGeneration": 1,
    "cols": 80,
    "rows": 24
  },
  "outputMetadata": {
    "type": "output",
    "schemaVersion": 1,
    "attachmentId": "0123456789abcdef0123456789abcdef",
    "sequence": 1
  },
  "errorMetadata": {
    "type": "error",
    "schemaVersion": 1,
    "attachmentId": "0123456789abcdef0123456789abcdef",
    "sequence": 0,
    "error": {
      "code": "channel_closed",
      "summary": "The terminal view is disconnected."
    }
  },
  "exited": {
    "type": "exited",
    "schemaVersion": 1,
    "attachmentId": "0123456789abcdef0123456789abcdef",
    "sequence": 2,
    "reason": "detached"
  }
}
